<?xml version = "1.0"?>
<!DOCTYPE label SYSTEM "label.dtd">
<label>
	<!-- in cm -->
	<height>3.4</height>
	<width>9.91</width>
	<qrcode>
		<!-- in cm -->
		<size>3.4</size>
		<x>0</x>
		<y>0</y>
	</qrcode>
	<text>
		<!-- in pt -->
		<ptsize>250</ptsize>
		<!-- in cm -->
		<x>3.9</x>
		<y>0</y>
	</text>
</label>
